index,title,content,url
0,Alzheimer's disease,Alzheimer’s disease is a physical illness which damages a person’s brain. This eventually causes dementia. Alzheimer’s disease is the most common cause of dementia.,https://www.alzheimers.org.uk/about-dementia/types-dementia/alzheimers-disease
0,Alzheimer's disease,"Symptoms of Alzheimer's disease Alzheimer’s disease affects everyone differently. However, it has some common early symptoms: memory problems thinking and reasoning difficulties language problems changes to how they see and hear things changes in mood",https://www.alzheimers.org.uk/about-dementia/types-dementia/alzheimers-disease
0,Alzheimer's disease,"The symptoms of Alzheimer’s disease will get worse over time. As Alzheimer's disease progresses, a person will need increasing support with everyday living.",https://www.alzheimers.org.uk/about-dementia/types-dementia/alzheimers-disease
0,Alzheimer's disease,"What causes Alzheimer's disease? The causes of Alzheimer’s disease are very complex, but one key part is the build-up of two substances inside the brain called amyloid and tau. When conditions in the brain aren’t right, these clump up and form tiny structures called plaques and tangles. These make it harder for the brain to work properly.",https://www.alzheimers.org.uk/about-dementia/types-dementia/alzheimers-disease
0,Alzheimer's disease,Over time the disease causes certain parts to become smaller. It also reduces the amount of important chemicals needed to send messages around the brain.,https://www.alzheimers.org.uk/about-dementia/types-dementia/alzheimers-disease
0,Alzheimer's disease,"Eventually the brain struggles to cope with the damage and the person begins to have problems with memory and thinking. When it gets to the stage where these problems are making it difficult for the person to do everyday tasks that they used to do easily, this is called ‘dementia’.",https://www.alzheimers.org.uk/about-dementia/types-dementia/alzheimers-disease
0,Alzheimer's disease,"Alzheimer’s disease or dementia? The term 'Alzheimer's disease' – or Alzheimer’s – can be used to describe the physical disease that damages the brain, as well as the type of dementia that the disease causes.",https://www.alzheimers.org.uk/about-dementia/types-dementia/alzheimers-disease
0,Alzheimer's disease,"Alzheimer’s disease or dementia? The term 'Alzheimer's disease' – or Alzheimer’s – can be used to describe the physical disease that damages the brain, as well as the type of dementia that the disease causes.",https://www.alzheimers.org.uk/about-dementia/types-dementia/alzheimers-disease
0,Alzheimer's disease,"What is the difference between dementia and Alzheimer’s disease? An older woman and man sitting at a table outside having a cup of teaAdvice Dementia is a condition where problems with memory or other types of thinking make it hard for a person to do everyday activities by themselves. It can be caused by several different diseases that affect the brain. Alzheimer’s disease is the most common cause of dementia. Dementia is a condition where problems with memory or other types of thinking make it hard for a person to do everyday activities by themselves. It can be caused by several different diseases that affect the brain. Alzheimer’s disease is the most common cause of dementia. ... 21 February 2023 Getting a diagnosis of Alzheimer's disease It is very important for anyone who has worsening problems with their memory or thinking to be assessed by a health professional, which is most often their GP. If a GP thinks their symptoms may be caused by dementia, they will refer the person to a local memory service for more detailed assessment.",https://www.alzheimers.org.uk/about-dementia/types-dementia/alzheimers-disease
0,Alzheimer's disease,Alzheimer’s will usually be diagnosed by a specialist health professional. Getting an early diagnosis has many benefits.,https://www.alzheimers.org.uk/about-dementia/types-dementia/alzheimers-disease
0,Alzheimer's disease,"Other types of Alzheimer’s disease There are some less common types of Alzheimer’s disease that do not cause memory problems at first. These are known as ‘atypical’ Alzheimer’s. There are four main types, which have different early symptoms:",https://www.alzheimers.org.uk/about-dementia/types-dementia/alzheimers-disease
0,Alzheimer's disease,"one mostly affecting language, called logopenic aphasia one causing problems with vision and working out where things are in relation to each other, called posterior cortical atrophy one that affects behaviour and/or thinking, called frontal variant Alzheimer’s disease one that causes problems with movement and sensation as well as thinking, perception and language, called corticobasal syndrome. Risk factors for Alzheimer's disease There are many different things that can increase a person’s chances of getting Alzheimer’s. These are known as ‘risk factors’. Some of these risk factors cannot be changed, but many others can. Age is the biggest risk factor for Alzheimer’s, as it is for most types of dementia.",https://www.alzheimers.org.uk/about-dementia/types-dementia/alzheimers-disease
1,Dementia with Lewy bodies (DLB): what is it and what causes it?,"Dementia with Lewy bodies (DLB) is a type of dementia caused by Lewy bodies, which are clumps of protein in the cells of the brain. Read more about what DLB is, and who gets the condition.",https://www.alzheimers.org.uk/about-dementia/types-dementia/dementia-with-lewy-bodies
1,Dementia with Lewy bodies (DLB): what is it and what causes it?,What is dementia with Lewy bodies? Dementia is caused by different diseases that affect the brain. Lewy body dementia is caused by Lewy body disease.,https://www.alzheimers.org.uk/about-dementia/types-dementia/dementia-with-lewy-bodies
1,Dementia with Lewy bodies (DLB): what is it and what causes it?,"In this disease, tiny clumps of proteins known as Lewy bodies appear in the nerve cells of the brain. Lewy bodies are named after FH Lewy, the German doctor who first identified them.",https://www.alzheimers.org.uk/about-dementia/types-dementia/dementia-with-lewy-bodies
1,Dementia with Lewy bodies (DLB): what is it and what causes it?,"Lewy bodies cause a range of symptoms, some of which are shared by Alzheimer’s disease and some by Parkinson’s disease. For this reason, DLB is often wrongly diagnosed. About 1 in 10 people with dementia has DLB.",https://www.alzheimers.org.uk/about-dementia/types-dementia/dementia-with-lewy-bodies
1,Dementia with Lewy bodies (DLB): what is it and what causes it?,What causes dementia with Lewy bodies? It is not yet known why Lewy bodies develop in the brain or exactly how they cause dementia. But we do know that Lewy body disease:,https://www.alzheimers.org.uk/about-dementia/types-dementia/dementia-with-lewy-bodies
1,Dementia with Lewy bodies (DLB): what is it and what causes it?,"can cause different symptoms depending on what parts of the brain have the biggest build-up of faulty proteins reduces the levels of important chemicals needed to send messages around the brain breaks the connections between nerve cells, eventually causing these cells to stop working usually develops over a period of many years – typically when a person is approaching old age. Lewy bodies can be developing in the brain for a long time before any symptoms show. Having Lewy body disease doesn’t mean that a person’s dementia is only caused by the build-up of Lewy bodies in their brain.",https://www.alzheimers.org.uk/about-dementia/types-dementia/dementia-with-lewy-bodies
1,Dementia with Lewy bodies (DLB): what is it and what causes it?,"Many people with DLB also have a build-up of other proteins that cause Alzheimer’s disease. This is common in people over about 80 years old. For people with both DLB and Alzheimer’s, dementia symptoms are often more severe and progress more quickly.",https://www.alzheimers.org.uk/about-dementia/types-dementia/dementia-with-lewy-bodies
1,Dementia with Lewy bodies (DLB): what is it and what causes it?,Parkinson's disease Parkinson’s disease is also caused by a build-up of Lewy bodies in the brain. DLB has a lot of symptoms in common with Parkinson’s disease. Both cause problems with:,https://www.alzheimers.org.uk/about-dementia/types-dementia/dementia-with-lewy-bodies
1,Dementia with Lewy bodies (DLB): what is it and what causes it?,"thinking movement mood how well the body works. In DLB, the symptoms of dementia begin before or around the same time as the person develops problems with movement.",https://www.alzheimers.org.uk/about-dementia/types-dementia/dementia-with-lewy-bodies
1,Dementia with Lewy bodies (DLB): what is it and what causes it?,"For people with Parkinson’s disease, symptoms of dementia often develop many years after the movement problems begin.",https://www.alzheimers.org.uk/about-dementia/types-dementia/dementia-with-lewy-bodies
1,Dementia with Lewy bodies (DLB): what is it and what causes it?,"Who gets dementia with Lewy bodies? Around 5% of people with a diagnosis of dementia are recorded as having DLB, but there is good evidence that the condition is under-diagnosed. Scientists think DLB may account for up to 20% of all dementia.",https://www.alzheimers.org.uk/about-dementia/types-dementia/dementia-with-lewy-bodies
1,Dementia with Lewy bodies (DLB): what is it and what causes it?,"Dementia with Lewy bodies affects men and women roughly equally. As with most other types of dementia, DLB becomes increasingly common over the age of 65. It can also affect people younger than this.",https://www.alzheimers.org.uk/about-dementia/types-dementia/dementia-with-lewy-bodies
1,Dementia with Lewy bodies (DLB): what is it and what causes it?,"There is not much evidence that anything we might be exposed to during our lives increases the risk of DLB. Having a traumatic head injury (or repeated injuries) may increase the risk of developing Parkinson’s disease later in life, but it’s not known whether this also applies to DLB.",https://www.alzheimers.org.uk/about-dementia/types-dementia/dementia-with-lewy-bodies
1,Dementia with Lewy bodies (DLB): what is it and what causes it?,"Almost all people who develop DLB have a ‘sporadic’ form, which means that the main cause is unknown. Some genes may increase the risk of developing DLB.",https://www.alzheimers.org.uk/about-dementia/types-dementia/dementia-with-lewy-bodies
2,Frontotemporal Dementia (FTD),Frontotemporal dementia (FTD) is one of the less common types of dementia. It is sometimes called Pick's disease or frontal lobe dementia. The first noticeable FTD symptoms are changes to personality and behaviour and/or difficulties with language.,https://www.alzheimers.org.uk/about-dementia/types-dementia/frontotemporal-dementia
2,Frontotemporal Dementia (FTD),"What is frontotemporal dementia (FTD)? Dementia describes a group of symptoms that can include problems with memory, thinking or language, and changes in mood, emotions and behaviour. It is caused when the brain is damaged by disease.",https://www.alzheimers.org.uk/about-dementia/types-dementia/frontotemporal-dementia
2,Frontotemporal Dementia (FTD),The word ‘frontotemporal’ refers to the two sets of lobes (frontal and temporal) in the brain that are damaged in this type of dementia. FTD occurs when disease damages nerve cells in these lobes.,https://www.alzheimers.org.uk/about-dementia/types-dementia/frontotemporal-dementia
2,Frontotemporal Dementia (FTD),This causes the connections between them and other parts of the brain to break down. The levels of chemical messengers in the brain also get lower over time. These messengers allow nerve cells to send signals to each other and the rest of the body.,https://www.alzheimers.org.uk/about-dementia/types-dementia/frontotemporal-dementia
2,Frontotemporal Dementia (FTD),"As more and more nerve cells are damaged and die, the brain tissue in the frontal and temporal lobes starts to get smaller.",https://www.alzheimers.org.uk/about-dementia/types-dementia/frontotemporal-dementia
2,Frontotemporal Dementia (FTD),"There are two broad types of Frontotemporal dementia: Behavioural variant FTD – where damage to the frontal lobes of the brain mainly causes problems with behaviour and personality. These lobes are found behind the forehead and process information that affects how we behave and the control of our emotions. They also help us to plan, solve problems and focus for long enough to finish a task. Primary progressive aphasia (PPA) occurs when damage to the temporal lobes – on either side of the head nearest the ears – causes language problems. This part of the brain has many roles. A key function of the left temporal lobe is to store the meanings of words and the names of objects. The right temporal lobe helps most people recognise familiar faces and objects. The first noticeable symptoms for a person with FTD will be changes to their personality and behaviour and/or difficulties with language.",https://www.alzheimers.org.uk/about-dementia/types-dementia/frontotemporal-dementia
2,Frontotemporal Dementia (FTD),"These are very different from the early symptoms of more common types of dementia. For example, in Alzheimer’s disease, early changes are often problems with day-to-day memory. In the early stages of FTD, many people can still remember recent events.",https://www.alzheimers.org.uk/about-dementia/types-dementia/frontotemporal-dementia
2,Frontotemporal Dementia (FTD),What are the symptoms of frontotemporal dementia? Frontotemporal dementia affects everyone differently. Its symptoms vary a lot and depend on which areas of the frontal and temporal lobes are damaged – and so the type of FTD the person has.,https://www.alzheimers.org.uk/about-dementia/types-dementia/frontotemporal-dementia
2,Frontotemporal Dementia (FTD),"As with most forms of dementia, FTD is progressive. This means its symptoms may be mild at first, but they will get worse over time.",https://www.alzheimers.org.uk/about-dementia/types-dementia/frontotemporal-dementia
2,Frontotemporal Dementia (FTD),Find out more about FTD symptoms below.,https://www.alzheimers.org.uk/about-dementia/types-dementia/frontotemporal-dementia
2,Frontotemporal Dementia (FTD),What are the symptoms of behavioural variant FTD? This is the most common type of frontotemporal dementia. In the early stages it mainly causes changes in someone’s personality and behaviour.,https://www.alzheimers.org.uk/about-dementia/types-dementia/frontotemporal-dementia
2,Frontotemporal Dementia (FTD),A person with behavioural variant FTD may:,https://www.alzheimers.org.uk/about-dementia/types-dementia/frontotemporal-dementia
2,Frontotemporal Dementia (FTD),"lose motivation to do things that they used to enjoy struggle to focus on tasks and become distracted easily find it difficult to plan, organise and make decisions – these problems may first appear at work or with managing money lose their inhibitions – behaving in socially inappropriate ways and acting impulsively or without thinking. For example, making insensitive or rude comments about someone’s appearance, making sexual gestures in public, staring at strangers, or being verbally or physically aggressive lose the ability to understand what others might be thinking or feeling – they may be less considerate of the needs of others, lose interest in social activities or be less friendly. They may also have less of a sense of humour or laugh at other people’s problems. This can make the person appear cold and selfish show repetitive or obsessive behaviours – for example, repeating phrases or gestures, hoarding or being obsessed with timekeeping. They may also take up new interests – for example, music or spirituality. These might give the person a positive focus but can become obsessive in nature crave sweet, fatty foods or carbohydrates and forget their table manners. They may also no longer know when to stop eating, drinking alcohol or smoking. FTD can also affect how sensitive a person is to physical or environmental stimulation such as temperature, sounds and even pain.",https://www.alzheimers.org.uk/about-dementia/types-dementia/frontotemporal-dementia
2,Frontotemporal Dementia (FTD),"Most people with behavioural variant FTD are not fully aware of their symptoms. Instead, these changes are often first noticed by the people who are close to them.",https://www.alzheimers.org.uk/about-dementia/types-dementia/frontotemporal-dementia
2,Frontotemporal Dementia (FTD),"As a result, people with this type of FTD rarely think they need to seek medical help for their condition. They may also refuse to do so if others suggest it. This can cause long delays in getting an accurate diagnosis. The person may also have problems taking medication or going to therapy sessions if they are not aware of their condition. Safe driving will also be difficult.",https://www.alzheimers.org.uk/about-dementia/types-dementia/frontotemporal-dementia
2,Frontotemporal Dementia (FTD),"This can all be very stressful for the family and carers of a person with behavioural variant FTD. It can also affect the person’s relationships. It may be helpful to call Alzheimer’s Society support line on 0333 150 3456 or visit our online community, Talking Point.",https://www.alzheimers.org.uk/about-dementia/types-dementia/frontotemporal-dementia
2,Frontotemporal Dementia (FTD),"What are the symptoms of primary progressive aphasia (language variants of FTD)? The other main type of FTD is primary progressive aphasia (PPA) where the early symptoms are mostly problems with language. Other aspects of thinking, perception and behaviour are not affected as much during the early stages.",https://www.alzheimers.org.uk/about-dementia/types-dementia/frontotemporal-dementia
2,Frontotemporal Dementia (FTD),"However, as the disease progresses, there may start to be changes in these areas.",https://www.alzheimers.org.uk/about-dementia/types-dementia/frontotemporal-dementia
2,Frontotemporal Dementia (FTD),The two main subtypes of PPA are:,https://www.alzheimers.org.uk/about-dementia/types-dementia/frontotemporal-dementia
2,Frontotemporal Dementia (FTD),semantic variant PPA non-fluent variant PPA.,https://www.alzheimers.org.uk/about-dementia/types-dementia/frontotemporal-dementia
2,Frontotemporal Dementia (FTD),Semantic variant PPA This condition causes a person to forget the meaning of words. About 1 in 5 people with FTD will have this type.,https://www.alzheimers.org.uk/about-dementia/types-dementia/frontotemporal-dementia
2,Frontotemporal Dementia (FTD),A person with semantic variant PPA is likely to:,https://www.alzheimers.org.uk/about-dementia/types-dementia/frontotemporal-dementia
2,Frontotemporal Dementia (FTD),"lose their vocabulary over time – at first mostly words they are less familiar with, such as technical words (for example ‘accelerator’) or less common words (for example ‘crinoline’). They may try to use more general words instead – for example, calling a ‘spanner’ a ‘tool’ or a ‘thingy’. As the condition develops, they will start to forget even basic words, such as ‘wet’ or ‘sugar’. forget what familiar objects are used for – for example, a person may forget what a toaster does and why it’s in the kitchen. These changes can cause a great loss of independence for the person with dementia.",https://www.alzheimers.org.uk/about-dementia/types-dementia/frontotemporal-dementia
2,Frontotemporal Dementia (FTD),"Along with losing the ability to communicate clearly, they may also eventually lose the skills to use everyday objects such as cutlery, toothbrushes or doors. See the ‘Treatment and support’ page for ideas about how to manage these symptoms.",https://www.alzheimers.org.uk/about-dementia/types-dementia/frontotemporal-dementia
2,Frontotemporal Dementia (FTD),"Although the main symptoms of semantic variant PPA involve language, the condition usually also causes changes in behaviour.",https://www.alzheimers.org.uk/about-dementia/types-dementia/frontotemporal-dementia
2,Frontotemporal Dementia (FTD),Getting obsessed about daily routines or having eating problems are common – like in behavioural variant FTD.,https://www.alzheimers.org.uk/about-dementia/types-dementia/frontotemporal-dementia
2,Frontotemporal Dementia (FTD),Non-fluent variant PPA This condition causes a person to have problems with speaking. About 1 in 4 people with FTD will have this condition.,https://www.alzheimers.org.uk/about-dementia/types-dementia/frontotemporal-dementia
2,Frontotemporal Dementia (FTD),"Over time, a person with non-fluent variant PPA will find it more and more difficult to get their words out.",https://www.alzheimers.org.uk/about-dementia/types-dementia/frontotemporal-dementia
2,Frontotemporal Dementia (FTD),They may also:,https://www.alzheimers.org.uk/about-dementia/types-dementia/frontotemporal-dementia
2,Frontotemporal Dementia (FTD),"start to speak differently – this includes speaking more slowly, using the wrong grammar and putting words in the wrong order. For example, ‘I gone to the shop.’ use shorter, simpler sentences that miss out shorter words (known as telegraphic speech) – for example, ‘Tired. Going bed now.’ say the opposite of what they mean – for example, saying ‘yes’ when they mean ‘no’. Unlike those with semantic variant PPA, many people with non-fluent variant PPA still understand individual words.",https://www.alzheimers.org.uk/about-dementia/types-dementia/frontotemporal-dementia
2,Frontotemporal Dementia (FTD),"However, over time they will struggle to understand full sentences that use these words. For example, a person with this condition may know what a ‘spoon’ is, but they may not know the meaning of ‘Can you pass me the spoon, please?’",https://www.alzheimers.org.uk/about-dementia/types-dementia/frontotemporal-dementia
2,Frontotemporal Dementia (FTD),"This makes it difficult for the person to have a conversation, which can be both frustrating and isolating.",https://www.alzheimers.org.uk/about-dementia/types-dementia/frontotemporal-dementia
2,Frontotemporal Dementia (FTD),At some point the person may stop speaking completely.,https://www.alzheimers.org.uk/about-dementia/types-dementia/frontotemporal-dementia
2,Frontotemporal Dementia (FTD),"What are the symptoms in the later stages of FTD? As FTD progresses, differences between the types described above become much less obvious.",https://www.alzheimers.org.uk/about-dementia/types-dementia/frontotemporal-dementia
2,Frontotemporal Dementia (FTD),"Many people with the behavioural variant develop language problems and may eventually lose all speech. Similarly, many people with a language variant of FTD (especially semantic variant dementia) develop clear changes in their behaviour and personality.",https://www.alzheimers.org.uk/about-dementia/types-dementia/frontotemporal-dementia
2,Frontotemporal Dementia (FTD),The later stages of all types of FTD bring a greater range of symptoms as the disease spreads to other areas of the brain. Any symptoms the person already has will also get worse.,https://www.alzheimers.org.uk/about-dementia/types-dementia/frontotemporal-dementia
2,Frontotemporal Dementia (FTD),"As a result, symptoms become similar to the later stages of other types of dementia, such as Alzheimer’s disease.",https://www.alzheimers.org.uk/about-dementia/types-dementia/frontotemporal-dementia
2,Frontotemporal Dementia (FTD),The person may:,https://www.alzheimers.org.uk/about-dementia/types-dementia/frontotemporal-dementia
2,Frontotemporal Dementia (FTD),"become forgetful have delusions or hallucinations get restless or agitated easily, or behave aggressively no longer recognise friends and family. At this late stage they are also likely to need full-time care to meet their daily needs.",https://www.alzheimers.org.uk/about-dementia/types-dementia/frontotemporal-dementia
2,Frontotemporal Dementia (FTD),"How quickly FTD progresses, and the life expectancy of someone with the condition varies from person to person. Many factors can affect the speed and pattern of progression. This includes a person’s age when they were diagnosed and whether they have other health conditions.",https://www.alzheimers.org.uk/about-dementia/types-dementia/frontotemporal-dementia
2,Frontotemporal Dementia (FTD),What are the symptoms of related conditions that can affect people with FTD? About 1 or 2 in every 10 people with frontotemporal dementia also develop one of a number of conditions that makes it harder for them to move. This can happen either before or after dementia symptoms first appear.,https://www.alzheimers.org.uk/about-dementia/types-dementia/frontotemporal-dementia
2,Frontotemporal Dementia (FTD),These are generally uncommon conditions but there are three that are more likely to affect people with FTD. These are:,https://www.alzheimers.org.uk/about-dementia/types-dementia/frontotemporal-dementia
2,Frontotemporal Dementia (FTD),motor neurone disease progressive supranuclear palsy corticobasal syndrome. Motor neurone disease Motor neurone disease (MND) is a progressive condition that causes muscles to weaken and waste away.,https://www.alzheimers.org.uk/about-dementia/types-dementia/frontotemporal-dementia
2,Frontotemporal Dementia (FTD),Eventually a person with MND becomes almost completely paralysed and struggles to breathe or swallow.,https://www.alzheimers.org.uk/about-dementia/types-dementia/frontotemporal-dementia
2,Frontotemporal Dementia (FTD),FTD and MND are both progressive and life-limiting conditions. Having the two conditions can reduce a person’s life expectancy more than FTD can on its own.,https://www.alzheimers.org.uk/about-dementia/types-dementia/frontotemporal-dementia
